movie,release_year,genre,audience_type,franchise_type,rating,thursday_preview_m,opening_weekend_m,source_url,notes
Bohemian Rhapsody,2018,music_biopic,broad_legacy,biopic,PG-13,3.9,51.061,https://www.the-numbers.com/movie/Bohemian-Rhapsody-%282018%29,The Numbers lists $51.061M opening weekend; The Numbers daily chart lists $3.9M Thursday previews.
Elvis,2022,music_biopic,broad_legacy,biopic,PG-13,3.5,31.2,https://en.wikipedia.org/wiki/Elvis_%282022_film%29,Opening day included $3.5M previews and weekend was $31.2M; seed comp only.
Rocketman,2019,music_biopic,broad_adult,biopic,R,2.3,25.7,https://www.boxofficepro.com/weekend-box-office-godzilla-aladdin-rocketman/,Preview value from contemporary reporting; weekend actual from Boxoffice Pro.
Straight Outta Compton,2015,music_biopic,fan_driven,biopic,R,5.0,60.2,https://en.wikipedia.org/wiki/Straight_Outta_Compton_%28film%29,Music biopic with strong fan-driven opening.
Taylor Swift: The Eras Tour,2023,concert_event,fan_driven,event,PG-13,2.8,92.8,https://www.cnbc.com/2023/10/16/taylor-swift-eras-tour-box-office-weekend.html,Concert-event comp; very low Thursday share because Friday screenings were constrained.
